results/2026-09-11_asymptotic_normality_case3/run/oracle_diagnostics/oracle_summary.csv

n,n_train,epochs,component,Q_available,Q_requested,true_theta,mean_theta_hat,bias,sqrt_n_train_scaled_bias,MC_SD_theta_hat,current_mean_SE,current_mean_T,current_SD_T,current_coverage,current_skewness,current_excess_kurtosis,current_SE_over_MC_SD,current_coverage_MCSE,oracle_A_mean_SE,oracle_A_mean_T,oracle_A_SD_T,oracle_A_coverage,oracle_A_skewness,oracle_A_excess_kurtosis,oracle_A_SE_over_MC_SD,oracle_A_coverage_MCSE,oracle_B_mean_SE,oracle_B_mean_T,oracle_B_SD_T,oracle_B_coverage,oracle_B_skewness,oracle_B_excess_kurtosis,oracle_B_SE_over_MC_SD,oracle_B_coverage_MCSE,oracle_B_SE,Z_MC_mean,Z_MC_sd,Z_MC_skewness,Z_MC_excess_kurtosis,Q_Z_MC_available,oracle_A_moment_mean_SE,oracle_A_moment_coverage,oracle_A_moment_max_abs_relative_SE_change,true_f0,mean_current_fhat0,mean_current_fhat0_over_true_f0
500,400,200,theta_1,200,200,1,0.76709643617272372,-0.23290356382727628,-4.6580712765455257,0.18110892248023769,0.2101937774429154,-1.1970143832500209,0.94968422708983069,0.80000000000000004,-0.44407949638722066,0.3450513978201557,1.160593164402772,0.028284271247461901,0.16245559253150837,-1.4316093565004397,1.11637486100352,0.68000000000000005,-0.055244507940448065,0.053827163559789781,0.89700490901675634,0.032984845004941282,0.16229182574504139,-1.4350911560583779,1.1159460536524972,0.66500000000000004,-0.039452474311113428,-0.031093598839969872,0.89610066429913415,0.033374765916782102,0.16229182574504139,2.9753977059954197e-16,0.99999999999999989,-0.039452474311114066,-0.031093598839969872,200,0.16244957706695978,0.68000000000000005,0.011279131192776126,0.36755259694786135,0.95678809005005983,2.6031324441595052
500,400,200,theta_2,200,200,-1,-0.67535493761301035,0.32464506238698965,6.4929012477397929,0.18544516497818805,0.18829589597868618,1.8269240486800788,1.1828888404755054,0.58499999999999996,0.4968714984547748,0.51147642378915181,1.0153723662778344,0.034840708948010807,0.15693415563676313,2.0654674974419929,1.1796931595476843,0.45500000000000002,-0.12470233297009883,-0.18081398391075831,0.84625638881025356,0.035211858797853886,0.1561544695407891,2.0789994890424128,1.1875751332865174,0.46999999999999997,-0.11134127133785267,-0.22376749820937025,0.84205198641418277,0.035291642070042588,0.15615446954078913,-2.7533531010703882e-16,1,-0.11134127133785264,-0.22376749820937025,200,0.15695540843456426,0.45500000000000002,0.0088098510257286211,0.36755259694786135,0.95678809005005983,2.6031324441595052
500,400,500,theta_1,200,200,1,0.82785814300179483,-0.17214185699820517,-3.4428371399641033,0.2020179426047507,0.26826150608718052,-0.82068548669719343,1.1415012404325298,0.875,-1.1047739644737118,2.9052161629903495,1.3279093066106298,0.023385358667337135,0.16245559253150837,-1.0599813658716919,1.2478985702932044,0.76000000000000001,-0.18216106350502925,-0.27177310988926351,0.80416417688875141,0.030199337741083,0.16229182574504139,-1.0606933294880672,1.2447819948869057,0.755,-0.18250827511306278,-0.32176998237425503,0.80335352222929179,0.030411757594719844,0.16229182574504139,-8.4376949871511898e-17,1,-0.1825082751130625,-0.32176998237425636,200,0.16244957706695978,0.76000000000000001,0.011279131192776126,0.36755259694786135,0.96894285866137408,2.636201911528929
500,400,500,theta_2,200,200,-1,-0.78448116078972818,0.21551883921027182,4.3103767842054364,0.19756620382405934,0.41187657985770398,0.58947068868821095,0.58925125742431783,0.98499999999999999,0.57508010018537836,1.132893945521162,2.0847522090594839,0.0085950567188355451,0.15693415563676313,1.3713912806723241,1.2613032031799933,0.69499999999999995,-0.10548050245867849,-0.13718806865771649,0.79433705056417092,0.032555721463361859,0.1561544695407891,1.3801643964726618,1.2651972396630826,0.68500000000000005,-0.097537271468500511,-0.15679036360930176,0.79039059575113835,0.032846232660687279,0.15615446954078913,9.3258734068513146e-17,0.99999999999999989,-0.097537271468499803,-0.15679036360930265,200,0.15695540843456426,0.69499999999999995,0.0088098510257286211,0.36755259694786135,0.96894285866137408,2.636201911528929
500,400,1000,theta_1,200,200,1,0.84867762822657822,-0.15132237177342178,-3.0264474354684356,0.23764844887231584,0.66183675180516677,-0.51435501577912635,0.98387027313796271,0.94999999999999996,-0.78901133459097261,3.389763009413981,2.7849403391677914,0.015411035007422448,0.16245559253150837,-0.9336757130739699,1.4679649252461571,0.76000000000000001,-0.23612408484066966,0.11100253375633784,0.68359626710121213,0.030199337741083,0.16229182574504139,-0.93240907900775905,1.4643279030310425,0.75,-0.22444509478773694,0.055266109534110264,0.6829071534661596,0.030618621784789725,0.16229182574504139,6.8833827526759705e-17,1,-0.22444509478773653,0.055266109534107599,200,0.16244957706695978,0.76000000000000001,0.011279131192776126,0.36755259694786135,0.7586626909941806,2.0640928598901986
500,400,1000,theta_2,200,200,-1,-0.81709045529365543,0.18290954470634457,3.6581908941268915,0.2177555396258859,0.79954887690480703,0.27986151086223499,0.3638374114219125,1,0.7786213022235644,1.4149434148707396,3.6717728434301558,0,0.15693415563676313,1.162853949997692,1.3870639777953642,0.68500000000000005,0.062485449157286703,-0.31248047245686061,0.72068961325339087,0.032846232660687279,0.1561544695407891,1.1713372357783636,1.3944880365336323,0.68500000000000005,0.070817819018524464,-0.33014441215226054,0.71710905637151512,0.032846232660687279,0.15615446954078913,1.3766765505351941e-16,1,0.070817819018524214,-0.33014441215226098,200,0.15695540843456426,0.68500000000000005,0.0088098510257286211,0.36755259694786135,0.7586626909941806,2.0640928598901986
1000,800,200,theta_1,200,200,1,0.90749687343835828,-0.092503126561641724,-2.6163835229077725,0.13055568509500876,0.14818145365539967,-0.66055403356642084,0.96861361654005207,0.91500000000000004,-0.078466793735130158,-0.10103605059924847,1.1350057528905324,0.019719913792915014,0.11477385139413805,-0.80406181346207861,1.1371189558600301,0.83999999999999997,0.20859702972480426,-0.46612635614957254,0.87911798946644215,0.025922962793631443,0.11475765051546433,-0.80607372272035438,1.1376643257210604,0.83499999999999996,0.20390051498948911,-0.48708040261959296,0.87899389775291836,0.02624642832844119,0.11475765051546429,2.353672812205332e-16,1,0.20390051498948922,-0.4870804026195934,200,0.11478372580330456,0.83999999999999997,0.0042204346513657898,0.36755259694786135,0.75198297266382408,2.045919356598902
1000,800,200,theta_2,200,200,-1,-0.84360108286142355,0.15639891713857645,4.4236293951568149,0.13080283074347837,0.14426160825208209,1.1079169967125286,0.95353302191649381,0.81000000000000005,0.12231732846235623,-0.14412780451451823,1.1028936257121082,0.027739863013360389,0.11077326527765806,1.408431439103029,1.1768428340285324,0.68500000000000005,-0.056229833894810469,-0.15759899037422676,0.84687207951102428,0.032846232660687279,0.11041788432488019,1.4164274029957624,1.1846163467379978,0.68500000000000005,-0.043210596253304999,-0.15604101912647694,0.84415515854870327,0.032846232660687279,0.11041788432488017,4.2188474935755947e-16,1,-0.043210596253304617,-0.15604101912647605,200,0.11077891508837316,0.68500000000000005,0.0036659621215111571,0.36755259694786135,0.75198297266382408,2.045919356598902
1000,800,500,theta_1,200,200,1,0.93382835075259207,-0.066171649247407927,-1.871616876205594,0.14875133025939755,0.23051234470487286,-0.3311382420150315,0.72880050992866663,0.98999999999999999,-0.65415297053921984,1.7937030471995037,1.5496489631581629,0.0070356236397351472,0.11477385139413805,-0.57286367223976242,1.2977867385825805,0.82499999999999996,0.0065374012976882005,-0.025964438971659121,0.77158201673888605,0.026867731575255849,0.11475765051546433,-0.57662080872325705,1.2962214683835167,0.82999999999999996,-0.0057074275689662666,-0.039289440226713879,0.77147310424280646,0.026561249970586856,0.11475765051546429,7.9936057773011268e-17,1,-0.0057074275689659752,-0.039289440226713435,200,0.11478372580330456,0.82499999999999996,0.0042204346513657898,0.36755259694786135,0.5487257412986597,1.4929176010596883
1000,800,500,theta_2,200,200,-1,-0.89341877311468121,0.10658122688531879,3.0145723311116357,0.14040952336860688,0.33982766883566512,0.3275856372589972,0.44269248183400539,1,0.12811751822426476,0.2284406677841786,2.4202608247842301,0,0.11077326527765806,0.95810923048680874,1.2677525380272505,0.77500000000000002,-0.16493351369951312,0.53408362677120014,0.78892985760554923,0.02952752952754429,0.11041788432488019,0.96525329693627437,1.271619395962007,0.77500000000000002,-0.15114477480478369,0.46713014394620922,0.78639882591872468,0.02952752952754429,0.11041788432488017,-2.575717417130363e-16,1,-0.15114477480478355,0.46713014394620789,200,0.11077891508837316,0.77500000000000002,0.0036659621215111571,0.36755259694786135,0.5487257412986597,1.4929176010596883
1000,800,1000,theta_1,200,200,1,0.95072650671005254,-0.049273493289947456,-1.3936648495228678,0.17281115882987838,0.32191656073964081,-0.16747254928516894,0.62058167502248651,0.98499999999999999,-0.39446558250735014,1.6231008917595506,1.8628227651464755,0.0085950567188355451,0.11477385139413805,-0.42573793901194579,1.5090725508076486,0.79000000000000004,-0.14011761400027023,-0.0581713060486444,0.66415763988438747,0.028801041647829335,0.11475765051546433,-0.42937000773911466,1.5058791989348983,0.79500000000000004,-0.149656575583097,-0.056078709221071055,0.66406389085346018,0.028546015483776364,0.11475765051546429,-3.1530333899354444e-16,1,-0.14965657558309731,-0.056078709221070611,200,0.11478372580330456,0.79000000000000004,0.0042204346513657898,0.36755259694786135,0.40620203231711038,1.1051534819511331
1000,800,1000,theta_2,200,200,-1,-0.91599826455116273,0.084001735448837267,2.3759278706924492,0.15792894481317407,0.62165488443093853,0.1413455352774243,0.2688769059777501,1,0.14742089388775989,0.29774469895539957,3.9362948012243129,0,0.11077326527765806,0.75518678827308494,1.4259803592426725,0.77000000000000002,-0.18997734943162442,0.70253754784268496,0.70141205216497848,0.029757352032733018,0.11041788432488019,0.76076204468544939,1.4302841045976133,0.78000000000000003,-0.17230857659040114,0.62275470041964542,0.69916179365031372,0.029291637031753616,0.11041788432488017,7.9936057773011268e-17,1,-0.17230857659040105,0.62275470041964676,200,0.11077891508837316,0.77000000000000002,0.0036659621215111571,0.36755259694786135,0.40620203231711038,1.1051534819511331
2000,1600,200,theta_1,200,200,1,0.98358506053686146,-0.016414939463138545,-0.65659757852554179,0.10203313714994616,0.12017687529253097,-0.14443972152425646,0.8677188926493653,0.96999999999999997,0.25649666124253828,0.29386830525962049,1.1778220159586104,0.012062338081814825,0.081171458339508534,-0.20381232066423652,1.2577007912164915,0.85999999999999999,0.41876746589215691,0.39376587397449603,0.79554016084225987,0.024535688292770596,0.081145912872520695,-0.20228917122327852,1.2574032817923813,0.86499999999999999,0.42490261996753653,0.41377107763438037,0.79528979642437181,0.024163505540380516,0.081145912872520695,-3.4861002973229917e-16,1,0.4249026199675367,0.41377107763438037,200,0.081175584185520788,0.85999999999999999,0.0024622826445329649,0.36755259694786135,0.55724646109362286,1.5160999152800714
2000,1600,200,theta_2,200,200,-1,-0.95027523219585419,0.049724767804145809,1.9889907121658323,0.084870684680474623,0.09912742181706953,0.51494186245079066,0.88320145538860739,0.95499999999999996,0.15278464485005797,0.20298815837875761,1.1679818796121344,0.014658615214269054,0.07795036177369484,0.63760809745056368,1.0870248199266017,0.89500000000000002,0.026712575675622775,-0.1449105075465873,0.9184603855520459,0.021676600286945368,0.078077234770394549,0.63686640478974188,1.0870093559288809,0.89000000000000001,0.03046467928347316,-0.13892231575853708,0.91995528331535925,0.022124646889837583,0.078077234770394563,5.3290705182007512e-17,1,0.030464679283473326,-0.13892231575853886,200,0.077947482984501312,0.89500000000000002,0.0021431898199762989,0.36755259694786135,0.55724646109362286,1.5160999152800714
2000,1600,500,theta_1,200,200,1,0.98720824718475342,-0.012791752815246582,-0.51167011260986328,0.11267780151418649,0.17989483307379864,-0.071561373604336592,0.64101067331831751,0.995,0.29638676869213915,0.56440395942965704,1.5965419155888421,0.0049874843358150029,0.081171458339508534,-0.15930969375136653,1.3884634442577415,0.83499999999999996,0.35556801829286944,0.53425559531821598,0.72038553511614967,0.02624642832844119,0.081145912872520695,-0.15763890456617671,1.3885825856836689,0.83499999999999996,0.35895641980486287,0.54480760540962869,0.7201588226080553,0.02624642832844119,0.081145912872520695,-8.8817841970012525e-18,1,0.3589564198048627,0.5448076054096278,200,0.081175584185520788,0.83499999999999996,0.0024622826445329649,0.36755259694786135,0.42098532009721068,1.1453743589163892
2000,1600,500,theta_2,200,200,-1,-0.9679297670722008,0.032070232927799203,1.2828093171119681,0.091900021088129724,0.17826256748945291,0.18226648251693145,0.53576919355325203,1,-0.14193040442520016,0.15582433783550709,1.9397445765382768,0,0.07795036177369484,0.4118804158825472,1.1773132786346869,0.89500000000000002,-0.19917149794441183,0.010663002947451261,0.84820831214981418,0.021676600286945368,0.078077234770394549,0.41075011201548933,1.1770399061696344,0.88500000000000001,-0.20381229551281274,0.026328820800400887,0.84958886674814271,0.022558257911461158,0.078077234770394563,2.3980817331903383e-16,1,-0.20381229551281288,0.026328820800400887,200,0.077947482984501312,0.89500000000000002,0.0021431898199762989,0.36755259694786135,0.42098532009721068,1.1453743589163892
2000,1600,1000,theta_1,200,200,1,0.98748614072799679,-0.012513859272003214,-0.50055437088012855,0.12136743729682097,0.2373803672047223,-0.052873735446699592,0.51969339763734224,1,0.44669915060685639,0.54006923958027642,1.955881845178749,0,0.081171458339508534,-0.15543420227027319,1.4956793552750327,0.81499999999999995,0.46804324933594238,0.58317978941361037,0.66880754959827016,0.027456784225396828,0.081145912872520695,-0.15421428916157867,1.4956691347780857,0.80500000000000005,0.4672804407098583,0.56123135764160903,0.66859706919630402,0.028015620642777128,0.081145912872520695,3.0642155479654318e-16,0.99999999999999989,0.46728044070985814,0.5612313576416077,200,0.081175584185520788,0.81499999999999995,0.0024622826445329649,0.36755259694786135,0.33662913822014018,0.91586657532960436
2000,1600,1000,theta_2,200,200,-1,-0.9809704920649529,0.019029507935047096,0.76118031740188385,0.099298696242311982,0.28371738101130345,0.070254376168891811,0.37375875353158605,1,-0.057758074914117927,0.07423587119077002,2.8572115420223327,0,0.07795036177369484,0.2436033887362023,1.2741997364176394,0.88500000000000001,-0.12363956181411631,0.091911487384709112,0.78500891475430623,0.022558257911461158,0.078077234770394549,0.24372671484854869,1.2718008845257438,0.88500000000000001,-0.12574456527054748,0.077570146206715318,0.78628660521249827,0.022558257911461158,0.078077234770394563,5.3290705182007512e-16,1,-0.1257445652705472,0.077570146206713098,200,0.077947482984501312,0.88500000000000001,0.0021431898199762989,0.36755259694786135,0.33662913822014018,0.91586657532960436
4000,3200,200,theta_1,200,200,1,0.98719551771879199,-0.012804482281208007,-0.72433090005001399,0.064161232905185078,0.083420238886262765,-0.15545063118990324,0.77937925629998694,0.98499999999999999,0.12994413321309212,0.23212280771802618,1.3001657715888639,0.0085950567188355451,0.057343175593932455,-0.22285252532694558,1.1193266163328275,0.92000000000000004,0.14343405972169881,0.23395695052339427,0.8937355626983029,0.019183326093250873,0.057378825257732163,-0.22315692633464215,1.1182040171960295,0.92000000000000004,0.14069266263928321,0.22317943378036365,0.89429118892594084,0.019183326093250873,0.057378825257732143,-4.8405723873656829e-16,0.99999999999999989,0.14069266263928312,0.22317943378036365,200,0.05734206510469015,0.92000000000000004,0.001689034552684876,0.36755259694786135,0.46942605198964032,1.2771670119806828
4000,3200,200,theta_2,200,200,-1,-0.98738824605941777,0.012611753940582227,0.71342853872334844,0.056913785223282755,0.064330780766905113,0.19477332268094988,0.87851683004941727,0.97999999999999998,0.14208101500456519,-0.2396846619236408,1.1303198428030079,0.0098994949366116684,0.055198712207418454,0.22835578961627617,1.0291306571228598,0.95499999999999996,0.23730337110320393,0.030516077318256229,0.96986541996572939,0.014658615214269054,0.055208942162440093,0.22843679749332962,1.0308798356582625,0.95499999999999996,0.24269759157423154,0.069895871498284023,0.97004516473198432,0.014658615214269054,0.055208942162440086,8.6153306710912145e-16,0.99999999999999989,0.24269759157423137,0.069895871498282691,200,0.055199079242120648,0.95499999999999996,0.0011555102291003205,0.36755259694786135,0.46942605198964032,1.2771670119806828
4000,3200,500,theta_1,200,200,1,0.9854561102390289,-0.014543889760971096,-0.82272664598498069,0.068961468347202348,0.12205823815743916,-0.11537927624738663,0.5766010707970286,1,0.023242723857645042,-0.063141149333025393,1.7699483651204893,0,0.057343175593932455,-0.25321338348237704,1.2036675598983073,0.89500000000000002,0.0034454496907451232,-0.22262492136711609,0.83152486407663295,0.021676600286945368,0.057378825257732163,-0.25347137547071324,1.2018626738599774,0.89500000000000002,0.0053118948916978,-0.22968973269032666,0.83204181455135628,0.021676600286945368,0.057378825257732143,3.7303493627405258e-16,1,0.0053118948916975692,-0.22968973269032666,200,0.05734206510469015,0.89500000000000002,0.001689034552684876,0.36755259694786135,0.37358055780250948,1.0164002673486843
4000,3200,500,theta_2,200,200,-1,-0.99918610572814937,0.00081389427185063479,0.046040812703557699,0.060155717921095191,0.095981269931434368,0.012399756488977811,0.63226740103792123,0.995,-0.090620899775519931,0.16609595112393905,1.5955469113897152,0.0049874843358150029,0.055198712207418454,0.014546969588924288,1.0885494591468103,0.93999999999999995,-0.090101192469012589,0.069019520365426246,0.91759709824793845,0.016792855623746671,0.055208942162440093,0.014742073294139226,1.0896009878997557,0.93500000000000005,-0.088809515312280318,0.091303080108264822,0.91776715614725657,0.01743201078476031,0.055208942162440086,-7.9936057773011273e-16,1,-0.088809515312279999,0.091303080108264378,200,0.055199079242120648,0.93999999999999995,0.0011555102291003205,0.36755259694786135,0.37358055780250948,1.0164002673486843
4000,3200,1000,theta_1,200,200,1,0.98481443613767627,-0.015185563862323725,-0.85902521465523896,0.072675917403606807,0.16886495021573289,-0.084510850647931013,0.44571845459007586,1,-0.0053493741181827401,-0.060660622745905446,2.3235337956305226,0,0.057343175593932455,-0.26457032324636193,1.2677248679744473,0.85499999999999998,-0.036011936375692576,-0.22122552262213491,0.78902582371924201,0.024897289009046749,0.057378825257732163,-0.26465449221230641,1.2665982107016609,0.85999999999999999,-0.039512034417505157,-0.2125634159216192,0.78951635297670875,0.024535688292770596,0.057378825257732143,-4.8405723873656829e-16,1,-0.039512034417505247,-0.21256341592161965,200,0.05734206510469015,0.85499999999999998,0.001689034552684876,0.36755259694786135,0.28219078984740742,0.76775621282696904
4000,3200,1000,theta_2,200,200,-1,-1.0042534041404725,-0.0042534041404724832,-0.24060887286840252,0.064119061694538543,0.14231812461713114,-0.028981634732548223,0.45656232708865346,1,-0.010074626199778818,0.3057377981859779,2.2195915045533696,0,0.055198712207418454,-0.077317814155957829,1.1610531153809445,0.92000000000000004,-0.061022693881026491,0.18522989709411819,0.86087835268681268,0.019183326093250873,0.055208942162440093,-0.077041942371540328,1.1613890645809224,0.92000000000000004,-0.061678218238338849,0.20437133553769415,0.86103789892394222,0.019183326093250873,0.055208942162440086,1.1102230246251565e-15,1,-0.061678218238338606,0.20437133553769327,200,0.055199079242120648,0.92000000000000004,0.0011555102291003205,0.36755259694786135,0.28219078984740742,0.76775621282696904

results/2026-09-11_asymptotic_normality_case3/consistency_plots/README.md

### theta_1: true value 1

- n=500, 200 to 1000 epochs: mean 0.76710 to 0.84868; absolute bias decreases (0.23290 to 0.15132); SD 0.18111 to 0.23765; RMSE 0.29475 to 0.28123.
- n=1000, 200 to 1000 epochs: mean 0.90750 to 0.95073; absolute bias decreases (0.09250 to 0.04927); SD 0.13056 to 0.17281; RMSE 0.15974 to 0.17928.
- n=2000, 200 to 1000 epochs: mean 0.98359 to 0.98749; absolute bias decreases (0.01641 to 0.01251); SD 0.10203 to 0.12137; RMSE 0.10309 to 0.12171.
- n=4000, 200 to 1000 epochs: mean 0.98720 to 0.98481; absolute bias increases (0.01280 to 0.01519); SD 0.06416 to 0.07268; RMSE 0.06527 to 0.07407.

### theta_2: true value -1

- n=500, 200 to 1000 epochs: mean -0.67535 to -0.81709; absolute bias decreases (0.32465 to 0.18291); SD 0.18545 to 0.21776; RMSE 0.37365 to 0.28397.
- n=1000, 200 to 1000 epochs: mean -0.84360 to -0.91600; absolute bias decreases (0.15640 to 0.08400); SD 0.13080 to 0.15793; RMSE 0.20368 to 0.17853.
- n=2000, 200 to 1000 epochs: mean -0.95028 to -0.98097; absolute bias decreases (0.04972 to 0.01903); SD 0.08487 to 0.09930; RMSE 0.09818 to 0.10086.
- n=4000, 200 to 1000 epochs: mean -0.98739 to -1.00425; absolute bias decreases (0.01261 to 0.00425); SD 0.05691 to 0.06412; RMSE 0.05816 to 0.06410.